Year;Title;Shortened_Title;Theme;Theme_Description;Description
1905;Separation of Church and State Law;Separation of Church and State Law;Policy Developments;Legislative measures and governmental decisions that shape society and institutions;The French Parliament passed the Law of Separation of Churches and State in 1905, establishing strict secularism (laïcité) in French society. This landmark legislation removed religious instruction from public schools and prohibited government funding of religious activities. The law fundamentally transformed French education and established France as a secular republic, influencing educational policy for over a century.
1908;Creation of the École Normale Supérieure Network;Creation of École Normale Supérieure Net;Institutions,Intellectual Achievements;Educational, research, and cultural organizations that preserve knowledge and advance learning, Scientific discoveries, artistic breakthroughs, and scholarly contributions that advance human knowledge;France expanded its network of École Normale Supérieure institutions in 1908 to train elite teachers and researchers across the country. These prestigious schools became centers of intellectual excellence, producing many of France's leading philosophers, scientists, and public servants. The network established France's reputation for rigorous academic training and intellectual sophistication.
1912;Worker Education Movement Emerges;Worker Education Movement Emerges;Social Movements;Grassroots organizing and collective action aimed at social, political, and economic change;A grassroots movement for worker education emerged in 1912 as labor unions and socialist organizations established evening schools and worker universities. These institutions provided literacy training, technical skills, and political education to working-class French citizens. The movement challenged traditional educational hierarchies and promoted the idea that knowledge should be accessible to all social classes.
1915;Women's Rights in Education Campaign;Women's Rights in Education Campaign;Social Movements;Grassroots organizing and collective action aimed at social, political, and economic change;French feminists launched a major campaign in 1915 demanding equal access to higher education and professional training for women. The movement organized demonstrations, published manifestos, and lobbied parliamentarians to remove gender barriers in universities and professional schools. Their activism laid the groundwork for significant educational reforms in the following decades.
1918;Reconstruction of War-Damaged Schools;Reconstruction of War-Damaged Schools;Policy Developments,Institutions;Legislative measures and governmental decisions that shape society and institutions, Educational, research, and cultural organizations that preserve knowledge and advance learning;Following World War I, France undertook a massive reconstruction program in 1918 to rebuild schools destroyed during the conflict. The program not only restored educational infrastructure but modernized facilities with new laboratories, libraries, and workshops. This reconstruction effort became a model for educational modernization throughout Europe.
1920;Alliance Française International Expansion;Alliance Française International Exp;Geopolitical Projects;International diplomatic initiatives and institutions that shape global relations and promote cooperation between nations;The Alliance Française began its major international expansion in 1920, establishing French language and culture centers around the world. This cultural diplomacy initiative promoted French intellectual influence globally and created international networks for educational exchange. The organization became a powerful tool for projecting French soft power and cultural values internationally.
1923;Popular Front Educational Reforms;Popular Front Educational Reforms;Policy Developments,Social Movements;Legislative measures and governmental decisions that shape society and institutions, Grassroots organizing and collective action aimed at social, political, and economic change;The Popular Front government implemented sweeping educational reforms in 1923, extending free public education and improving conditions for teachers. The reforms emphasized democratic education, scientific instruction, and cultural development for all citizens. These changes reflected the progressive political coalition's commitment to social equality and educational access.
1925;Sorbonne University Modernization;Sorbonne University Modernization;Institutions,Intellectual Achievements;Educational, research, and cultural organizations that preserve knowledge and advance learning, Scientific discoveries, artistic breakthroughs, and scholarly contributions that advance human knowledge;The University of Paris (Sorbonne) underwent major modernization in 1925, establishing new research institutes and updating its curriculum for the modern era. The university strengthened its international partnerships and attracted leading scholars from around the world. This modernization reinforced Paris's position as a global center of higher learning and intellectual life.
1928;Rural School Development Initiative;Rural School Development Initiative;Policy Developments,Institutions;Legislative measures and governmental decisions that shape society and institutions, Educational, research, and cultural organizations that preserve knowledge and advance learning;France launched a comprehensive rural school development program in 1928 to address educational inequalities between urban and rural areas. The initiative built new schools, trained specialized rural teachers, and developed curricula relevant to agricultural communities. The program significantly improved literacy rates and educational opportunities in France's countryside.
1930;International Student Exchange Program;International Student Exchange Program;Geopolitical Projects,Institutions;International diplomatic initiatives and institutions that shape global relations and promote cooperation between nations, Educational, research, and cultural organizations that preserve knowledge and advance learning;France established a formal international student exchange program in 1930, facilitating academic mobility between French universities and institutions worldwide. The program promoted cross-cultural understanding and positioned France as a leader in international education cooperation. Thousands of students participated, creating lasting intellectual and diplomatic connections.
1932;Marie Curie Institute of Science;Marie Curie Institute of Science;Intellectual Achievements,Institutions;Scientific discoveries, artistic breakthroughs, and scholarly contributions that advance human knowledge, Educational, research, and cultural organizations that preserve knowledge and advance learning;The Marie Curie Institute of Science was founded in 1932 to advance women's participation in scientific research and education. Named after France's Nobel Prize-winning scientist, the institute provided research opportunities and mentorship for female scientists. It became a model for promoting gender equality in STEM fields and contributed significantly to French scientific advancement.
1935;Cultural Heritage Education Program;Cultural Heritage Education Program;Intellectual Achievements,Policy Developments;Scientific discoveries, artistic breakthroughs, and scholarly contributions that advance human knowledge, Legislative measures and governmental decisions that shape society and institutions;France implemented a comprehensive cultural heritage education program in 1935, integrating French history, art, and literature into the national curriculum. The program aimed to strengthen national identity while promoting appreciation for cultural diversity. It established France's commitment to preserving and transmitting its rich cultural heritage through education.
1938;Technical Education Expansion;Technical Education Expansion;Policy Developments,Institutions;Legislative measures and governmental decisions that shape society and institutions, Educational, research, and cultural organizations that preserve knowledge and advance learning;France significantly expanded its technical and vocational education system in 1938 to meet growing industrial demands. New technical colleges and apprenticeship programs were established to train skilled workers in modern manufacturing and engineering. This expansion helped modernize the French economy and provided practical education alternatives to traditional academic paths.
1940;Resistance Education Networks;Resistance Education Networks;Social Movements;Grassroots organizing and collective action aimed at social, political, and economic change;During World War II, French resistance fighters established secret education networks in 1940 to preserve democratic values and French culture under occupation. These underground schools taught banned subjects, maintained intellectual freedom, and prepared for post-war reconstruction. The networks demonstrated the power of education as a form of resistance and cultural preservation.
1943;Free French Educational Charter;Free French Educational Charter;Policy Developments,Geopolitical Projects;Legislative measures and governmental decisions that shape society and institutions, International diplomatic initiatives and institutions that shape global relations and promote cooperation between nations;The Free French government-in-exile published an Educational Charter in 1943 outlining plans for post-war educational reconstruction and reform. The charter emphasized democratic education, international cooperation, and the role of education in rebuilding French society. It became the foundation for major educational reforms implemented after the Liberation.
1945;Liberation and Educational Reconstruction;Liberation & Educational Reconstruction;Policy Developments,Institutions;Legislative measures and governmental decisions that shape society and institutions, Educational, research, and cultural organizations that preserve knowledge and advance learning;Following the Liberation in 1945, France began comprehensive reconstruction of its educational system, implementing democratic reforms and rebuilding war-damaged institutions. The reconstruction emphasized modern pedagogical methods, international cooperation, and educational equality. This effort established the framework for France's modern educational system.
1947;UNESCO Headquarters Established in Paris;UNESCO Headquarters Established in Paris;Geopolitical Projects,Institutions;International diplomatic initiatives and institutions that shape global relations and promote cooperation between nations, Educational, research, and cultural organizations that preserve knowledge and advance learning;Paris became the permanent headquarters of UNESCO in 1947, establishing France as a global center for international educational and cultural cooperation. The organization promoted education, science, and cultural exchange worldwide. This choice reflected France's commitment to international cooperation and its influence in global educational affairs.
1950;Democratization of Higher Education;Democratization of Higher Education;Policy Developments,Social Movements;Legislative measures and governmental decisions that shape society and institutions, Grassroots organizing and collective action aimed at social, political, and economic change;France implemented major reforms in 1950 to democratize access to higher education, removing financial and social barriers for working-class students. The reforms included expanded scholarships, new regional universities, and alternative pathways to university admission. These changes dramatically increased university enrollment and promoted social mobility through education.
1953;National Teacher Training Reform;National Teacher Training Reform;Policy Developments,Institutions;Legislative measures and governmental decisions that shape society and institutions, Educational, research, and cultural organizations that preserve knowledge and advance learning;France reformed its teacher training system in 1953, establishing regional teacher training colleges and modernizing pedagogical instruction. The reform emphasized child psychology, innovative teaching methods, and professional development for educators. This investment in teacher quality significantly improved educational outcomes across the French school system.
1955;Algerian War and Educational Policy;Algerian War and Educational Policy;Geopolitical Projects,Policy Developments;International diplomatic initiatives and institutions that shape global relations and promote cooperation between nations, Legislative measures and governmental decisions that shape society and institutions;The Algerian War beginning in 1955 profoundly affected French educational policy, particularly regarding colonial education and integration of North African immigrants. The conflict raised questions about French identity, citizenship, and the role of education in assimilating diverse populations. These debates shaped educational policies for decades to come.
1958;Fifth Republic Education Constitution;Fifth Republic Education Constitution;Policy Developments,Institutions;Legislative measures and governmental decisions that shape society and institutions, Educational, research, and cultural organizations that preserve knowledge and advance learning;The new Fifth Republic constitution in 1958 established education as a fundamental right and outlined the state's responsibility for providing quality education to all citizens. The constitutional framework strengthened public education and established principles that continue to guide French educational policy. It reflected France's commitment to education as a cornerstone of republican democracy.
1962;Decolonization and Educational Reorientation;Decolonization & Educational Reorient;Geopolitical Projects,Policy Developments;International diplomatic initiatives and institutions that shape global relations and promote cooperation between nations, Legislative measures and governmental decisions that shape society and institutions;The end of French colonial empire in 1962 led to major reorientation of educational policy, including curriculum changes and new approaches to teaching French history and geography. The decolonization process brought many repatriated French citizens and immigrants to metropolitan France, requiring adaptation of educational systems. This transition reshaped French educational content and cultural perspectives.
1965;Comprehensive Secondary School Reform;Comprehensive Secondary School Reform;Policy Developments,Institutions;Legislative measures and governmental decisions that shape society and institutions, Educational, research, and cultural organizations that preserve knowledge and advance learning;France implemented comprehensive secondary school reform in 1965, creating a unified system that provided both academic and technical education pathways. The reform aimed to reduce social segregation and provide more flexible educational options for students. This restructuring modernized French secondary education and improved opportunities for social mobility.
1968;May 1968 Student Revolution;May 1968 Student Revolution;Social Movements;Grassroots organizing and collective action aimed at social, political, and economic change;The student revolution of May 1968 fundamentally challenged traditional French educational authority and demanded democratic participation in university governance. Students occupied universities, organized general strikes, and called for radical educational reforms. The movement led to significant changes in university administration, curriculum flexibility, and student rights that transformed French higher education.
1970;Comprehensive Higher Education Reform;Comprehensive Higher Education Reform;Policy Developments,Institutions;Legislative measures and governmental decisions that shape society and institutions, Educational, research, and cultural organizations that preserve knowledge and advance learning;Following the 1968 upheavals, France implemented comprehensive higher education reform in 1970, creating autonomous universities and expanding access to higher education. The reform decentralized university governance, established new degree structures, and promoted interdisciplinary studies. These changes modernized French higher education and increased its international competitiveness.
